{
  "@context": [
    "https://www.w3.org/2018/credentials/v1",
    "https://example.com/contexts/kyb/v1"
  ],
  "id": "urn:uuid:3a84e4b2-7c1f-4e9a-b6d3-9f2c8e1a5d70",
  "type": ["VerifiableCredential", "KYBCredential"],
  "issuer": "did:web:issuer-alpha.example",
  "issuanceDate": "2025-03-01T12:00:00Z",
  "expirationDate": "2026-03-01T12:00:00Z",
  "credentialSubject": {
    "id": "did:web:acme-widgets.example",
    "legalName": "Acme Widgets International Ltd.",
    "tradeName": "Acme Widgets",
    "jurisdictionOfIncorporation": "US",
    "registrationNumber": "EX-2024-78901234",
    "dateOfIncorporation": "2019-06-15",
    "entityType": "Corporation",
    "entityStatus": "Active",
    "registeredAddress": {
      "streetAddress": "742 Innovation Boulevard, Suite 400",
      "city": "Metropolis",
      "stateOrProvince": "NY",
      "postalCode": "10001",
      "country": "US"
    },
    "taxIdentifier": "XX-1234567",
    "beneficialOwners": [
      {
        "name": "Jane Doe",
        "dateOfBirth": "1985-04-12",
        "nationality": "US",
        "ownershipPercentage": 60,
        "pep": false,
        "sanctionsScreeningPassed": true
      },
      {
        "name": "John Smith",
        "dateOfBirth": "1990-08-25",
        "nationality": "GB",
        "ownershipPercentage": 40,
        "pep": false,
        "sanctionsScreeningPassed": true
      }
    ],
    "verificationLevel": "standard"
  },
  "credentialStatus": {
    "id": "https://issuer-alpha.example/api/v1/status/1#42",
    "type": "StatusList2021Entry",
    "statusPurpose": "revocation",
    "statusListIndex": "42",
    "statusListCredential": "https://issuer-alpha.example/api/v1/status/1"
  },
  "proof": {
    "type": "Ed25519Signature2020",
    "created": "2025-03-01T12:00:00Z",
    "verificationMethod": "did:web:issuer-alpha.example#key-1",
    "proofPurpose": "assertionMethod",
    "proofValue": "z58DAdFfa9SkqZMVPxAQpic7ndTn4fXjBz9uPfp7LHKVjARhPCf9Zu3cdiQHSENRNWfqEsaYJmqRY3hqspzCVUqCs"
  }
}
